{"findings":[{"control_id":"SW-CA-C02","failure_code":null,"passed":true,"probe_id":"probe:decision:0dfae056-71c6-5101-b707-6f26f9e82346","right_censored":false,"synthetic":true},{"control_id":"SW-CA-C02","failure_code":null,"passed":true,"probe_id":"probe:decision:1466e3e3-ac93-5fef-8e27-41b60346a7c1","right_censored":false,"synthetic":true},{"control_id":"SW-CA-C02","failure_code":null,"passed":true,"probe_id":"probe:decision:266ca67e-4ab6-576c-a0a8-35ac6ef528b6","right_censored":false,"synthetic":true},{"control_id":"SW-CA-C02","failure_code":null,"passed":true,"probe_id":"probe:decision:32355049-401c-5336-8694-df3844548ed8","right_censored":false,"synthetic":true},{"control_id":"SW-CA-C02","failure_code":null,"passed":true,"probe_id":"probe:decision:432144a7-90db-5099-ad31-4eeab3ae432f","right_censored":false,"synthetic":true},{"control_id":"SW-CA-C02","failure_code":null,"passed":true,"probe_id":"probe:decision:521020ba-83c0-5b20-bcbe-245f4cd00f4e","right_censored":false,"synthetic":true},{"control_id":"SW-CA-C02","failure_code":null,"passed":true,"probe_id":"probe:decision:85b49a5e-9fbe-529e-a0cf-d12a3e4ec5c8","right_censored":false,"synthetic":true},{"control_id":"SW-CA-C02","failure_code":null,"passed":true,"probe_id":"probe:decision:a8f2be95-b5bf-5bd0-a624-8f459f0f6ca7","right_censored":false,"synthetic":true},{"control_id":"SW-CA-C02","failure_code":null,"passed":true,"probe_id":"probe:decision:cf3c46f9-1a6f-5533-9be1-897dea33a1cc","right_censored":false,"synthetic":true},{"control_id":"SW-CA-C02","failure_code":null,"passed":true,"probe_id":"probe:decision:ebd16901-8625-5729-8986-ecf17440e5f4","right_censored":false,"synthetic":true},{"control_id":"SW-CA-C04","failure_code":null,"passed":true,"probe_id":"probe:delivery:1f4ab460-a7b3-5c46-8fe8-ccd7f5249f85","right_censored":false,"synthetic":true},{"control_id":"SW-CA-C04","failure_code":null,"passed":true,"probe_id":"probe:delivery:20c794b9-f734-55f2-844f-516a0001e1e0","right_censored":false,"synthetic":true},{"control_id":"SW-CA-C04","failure_code":null,"passed":true,"probe_id":"probe:delivery:30ed3519-ef20-59d5-9cf8-5912510388fd","right_censored":false,"synthetic":true},{"control_id":"SW-CA-C04","failure_code":null,"passed":true,"probe_id":"probe:delivery:35e6055e-25be-57b7-8bda-da412856e34c","right_censored":false,"synthetic":true},{"control_id":"SW-CA-C04","failure_code":null,"passed":true,"probe_id":"probe:delivery:8bd879ae-e736-5477-92f6-e26542ed4b15","right_censored":false,"synthetic":true},{"control_id":"SW-CA-C04","failure_code":null,"passed":true,"probe_id":"probe:delivery:9ff206c0-5d3b-5dae-b308-e26efbc61e03","right_censored":false,"synthetic":true},{"control_id":"SW-CA-C04","failure_code":null,"passed":true,"probe_id":"probe:delivery:c8f147ea-b6e3-5671-b820-e0a3eb6e79b7","right_censored":false,"synthetic":true},{"control_id":"SW-CA-C04","failure_code":null,"passed":true,"probe_id":"probe:delivery:f49a350b-03c4-5d80-bcfb-098e34f37925","right_censored":false,"synthetic":true},{"control_id":"SW-CA-C03","failure_code":null,"passed":true,"probe_id":"probe:enforcement:0dfae056-71c6-5101-b707-6f26f9e82346","right_censored":false,"synthetic":true},{"control_id":"SW-CA-C03","failure_code":null,"passed":true,"probe_id":"probe:enforcement:1466e3e3-ac93-5fef-8e27-41b60346a7c1","right_censored":false,"synthetic":true},{"control_id":"SW-CA-C03","failure_code":null,"passed":true,"probe_id":"probe:enforcement:266ca67e-4ab6-576c-a0a8-35ac6ef528b6","right_censored":false,"synthetic":true},{"control_id":"SW-CA-C03","failure_code":null,"passed":true,"probe_id":"probe:enforcement:32355049-401c-5336-8694-df3844548ed8","right_censored":false,"synthetic":true},{"control_id":"SW-CA-C03","failure_code":null,"passed":true,"probe_id":"probe:enforcement:432144a7-90db-5099-ad31-4eeab3ae432f","right_censored":false,"synthetic":true},{"control_id":"SW-CA-C03","failure_code":null,"passed":true,"probe_id":"probe:enforcement:521020ba-83c0-5b20-bcbe-245f4cd00f4e","right_censored":false,"synthetic":true},{"control_id":"SW-CA-C03","failure_code":null,"passed":true,"probe_id":"probe:enforcement:85b49a5e-9fbe-529e-a0cf-d12a3e4ec5c8","right_censored":false,"synthetic":true},{"control_id":"SW-CA-C03","failure_code":null,"passed":true,"probe_id":"probe:enforcement:a8f2be95-b5bf-5bd0-a624-8f459f0f6ca7","right_censored":false,"synthetic":true},{"control_id":"SW-CA-C03","failure_code":null,"passed":true,"probe_id":"probe:enforcement:cf3c46f9-1a6f-5533-9be1-897dea33a1cc","right_censored":false,"synthetic":true},{"control_id":"SW-CA-C03","failure_code":null,"passed":true,"probe_id":"probe:enforcement:ebd16901-8625-5729-8986-ecf17440e5f4","right_censored":false,"synthetic":true},{"control_id":"SW-CA-C06","failure_code":null,"passed":true,"probe_id":"probe:evidence:0dfae056-71c6-5101-b707-6f26f9e82346","right_censored":false,"synthetic":true},{"control_id":"SW-CA-C06","failure_code":null,"passed":true,"probe_id":"probe:evidence:1466e3e3-ac93-5fef-8e27-41b60346a7c1","right_censored":false,"synthetic":true},{"control_id":"SW-CA-C06","failure_code":null,"passed":true,"probe_id":"probe:evidence:266ca67e-4ab6-576c-a0a8-35ac6ef528b6","right_censored":false,"synthetic":true},{"control_id":"SW-CA-C06","failure_code":null,"passed":true,"probe_id":"probe:evidence:32355049-401c-5336-8694-df3844548ed8","right_censored":false,"synthetic":true},{"control_id":"SW-CA-C06","failure_code":null,"passed":true,"probe_id":"probe:evidence:432144a7-90db-5099-ad31-4eeab3ae432f","right_censored":false,"synthetic":true},{"control_id":"SW-CA-C06","failure_code":null,"passed":true,"probe_id":"probe:evidence:521020ba-83c0-5b20-bcbe-245f4cd00f4e","right_censored":false,"synthetic":true},{"control_id":"SW-CA-C06","failure_code":null,"passed":true,"probe_id":"probe:evidence:85b49a5e-9fbe-529e-a0cf-d12a3e4ec5c8","right_censored":false,"synthetic":true},{"control_id":"SW-CA-C06","failure_code":null,"passed":true,"probe_id":"probe:evidence:a8f2be95-b5bf-5bd0-a624-8f459f0f6ca7","right_censored":false,"synthetic":true},{"control_id":"SW-CA-C06","failure_code":null,"passed":true,"probe_id":"probe:evidence:cf3c46f9-1a6f-5533-9be1-897dea33a1cc","right_censored":false,"synthetic":true},{"control_id":"SW-CA-C06","failure_code":null,"passed":true,"probe_id":"probe:evidence:ebd16901-8625-5729-8986-ecf17440e5f4","right_censored":false,"synthetic":true},{"control_id":"SW-CA-C01","failure_code":null,"passed":true,"probe_id":"probe:mapping:business_justification","right_censored":false,"synthetic":true},{"control_id":"SW-CA-C01","failure_code":null,"passed":true,"probe_id":"probe:mapping:case_assignment","right_censored":false,"synthetic":true},{"control_id":"SW-CA-C01","failure_code":null,"passed":true,"probe_id":"probe:mapping:device_posture","right_censored":false,"synthetic":true},{"control_id":"SW-CA-C01","failure_code":null,"passed":true,"probe_id":"probe:mapping:on_call","right_censored":false,"synthetic":true},{"control_id":"SW-CA-C01","failure_code":null,"passed":true,"probe_id":"probe:mapping:risk_signal","right_censored":false,"synthetic":true},{"control_id":"SW-CA-C05","failure_code":null,"passed":true,"probe_id":"probe:sync:fault:delayed_delivery","right_censored":false,"synthetic":true},{"control_id":"SW-CA-C05","failure_code":null,"passed":true,"probe_id":"probe:sync:fault:duplicate_delivery","right_censored":false,"synthetic":true},{"control_id":"SW-CA-C05","failure_code":null,"passed":true,"probe_id":"probe:sync:fault:out_of_order_delivery","right_censored":false,"synthetic":true}],"metrics":[{"denominator":5,"denominator_meaning":"predeclared SW-CA-C01 contextual probes","empty_behaviour":"null_if_empty","family":"SW-CA-C01","name":"mapping_ingestion_accuracy","numerator":5,"support":5,"synthetic":true,"value":1.0},{"denominator":10,"denominator_meaning":"predeclared SW-CA-C02 contextual probes","empty_behaviour":"null_if_empty","family":"SW-CA-C02","name":"decision_accuracy","numerator":10,"support":10,"synthetic":true,"value":1.0},{"denominator":10,"denominator_meaning":"predeclared SW-CA-C03 contextual probes","empty_behaviour":"null_if_empty","family":"SW-CA-C03","name":"enforcement_accuracy","numerator":10,"support":10,"synthetic":true,"value":1.0},{"denominator":8,"denominator_meaning":"predeclared SW-CA-C04 contextual probes","empty_behaviour":"null_if_empty","family":"SW-CA-C04","name":"feed_delay_within_bound","numerator":8,"support":8,"synthetic":true,"value":1.0},{"denominator":8,"denominator_meaning":"predeclared SW-CA-C04 contextual probes","empty_behaviour":"null_if_empty","family":"SW-CA-C04","name":"sut_acceptance_within_bound","numerator":8,"support":8,"synthetic":true,"value":1.0},{"denominator":3,"denominator_meaning":"predeclared SW-CA-C05 contextual probes","empty_behaviour":"null_if_empty","family":"SW-CA-C05","name":"synchronization_resilience","numerator":3,"support":3,"synthetic":true,"value":1.0},{"denominator":10,"denominator_meaning":"predeclared SW-CA-C06 contextual probes","empty_behaviour":"null_if_empty","family":"SW-CA-C06","name":"evidence_completeness","numerator":10,"support":10,"synthetic":true,"value":1.0},{"denominator":6,"denominator_meaning":"transition probes with a correct post-acceptance decision within the declared nanosecond bound; missing correct decisions are right-censored failures","empty_behaviour":"null_if_empty","family":"propagation","name":"post_acceptance_decision_propagation","numerator":6,"support":6,"synthetic":true,"value":1.0}],"run_id":"contextual-reference-run-1","schema_version":"1.0.0","synthetic":true,"truth_digest":{"algorithm":"sha256","value":"8b8f93559a4de22e7d0209f4ba34d6b6317a0f9965ae194344708b2c46bd48c6"}}
